{
  "youtube_metadata": {
    "title": "22 An√∫ncios em 18 Minutos: Conhe√ßa o Codexa (IA E-commerce)",
    "description": "22 an√∫ncios de e-commerce em apenas 18 minutos. Parece imposs√≠vel? Com o Codexa, √© s√≥ o come√ßo. Descubra como a IA est√° revolucionando a forma de vender online.\n\nüìå O QUE VOC√ä VAI DESCOBRIR NESTE V√çDEO:\n‚Ä¢ Como o Codexa analisa SEO de marketplaces automaticamente\n‚Ä¢ A t√©cnica de otimiza√ß√£o de t√≠tulos que aumenta cliques em 47%\n‚Ä¢ Gera√ß√£o de imagens de alta convers√£o com IA\n‚Ä¢ Como espionar concorrentes de forma √©tica e estrat√©gica\n‚Ä¢ Por que 150 lojistas deram nota 4.8 para o Codexa\n\nüë§ PARA QUEM √â ESSE V√çDEO:\nVendedores de Mercado Livre, Shopee, Amazon e lojistas que querem escalar sem perder horas em tarefas repetitivas.\n\n‚è±Ô∏è CAP√çTULOS:\n00:00 O Problema: Horas Perdidas em An√∫ncios\n00:30 Descobrindo o Codexa\n01:15 Explorando An√°lise SEO Autom√°tica\n02:00 Otimizando T√≠tulos com IA\n02:45 Criando Imagens Profissionais\n03:30 Analisando a Concorr√™ncia\n04:15 Resultados: 150 Reviews, 4.8 Estrelas\n05:00 Come√ßando Gr√°tis no Codexa\n\nüîó LINKS IMPORTANTES:\n‚Ä¢ Comece Gr√°tis: https://codexaapp.com\n‚Ä¢ Planos e Pre√ßos: https://codexaapp.com/precos\n\nüì± SIGA O CODEXA:\n‚Ä¢ Instagram: @codexaapp\n‚Ä¢ LinkedIn: /company/codexa\n\nüîî Gostou? Inscreva-se e ative o sininho para mais dicas de e-commerce com IA!\n\nüìß D√∫vidas? contato@codexaapp.com\n\nO Codexa √© a plataforma de IA para e-commerce que est√° transformando a forma como vendedores criam an√∫ncios, otimizam t√≠tulos e geram imagens profissionais para marketplaces.\n\n#Codexa #Ecommerce #IAparaVendedores #MercadoLivre #Shopee",
    "tags": "Codexa,IA e-commerce,automa√ß√£o e-commerce,an√∫ncios marketplace,intelig√™ncia artificial,Codexa app,IA para vendedores,criar an√∫ncios r√°pido,otimiza√ß√£o de t√≠tulos,SEO marketplace,Mercado Livre dicas,Shopee vendedor,Amazon seller Brasil,e-commerce 2024,produtividade lojista,como criar an√∫ncios e-commerce r√°pido,IA para criar an√∫ncios marketplace,automa√ß√£o Mercado Livre,otimiza√ß√£o de produtos Shopee,ferramentas para vendedores online,criar descri√ß√£o de produtos IA,gera√ß√£o de imagens e-commerce,an√°lise de concorr√™ncia marketplace,como vender mais no Mercado Livre,t√≠tulo de produto que vende,automa√ß√£o de an√∫ncios online,IA para lojistas iniciantes,escalar vendas e-commerce,tecnologia,empreendedorismo digital,marketing digital,dropshipping,vendas online,neg√≥cios digitais,produtividade",
    "thumbnail_text": "10x Mais R√°pido"
  },
  "score": 8.92,
  "generated": "2025-12-04",
  "version": "video_agent_v2.8.0"
}
